[
  {
    "place_key": "aegean_sea",
    "display_name": "Aegean Sea",
    "ancient_names_in_galen": [
      {
        "surface": "Αἰγαῖον",
        "passage_id": "smt.9.1"
      },
      {
        "surface": "Αἰγαίου",
        "passage_id": "smt.9.1"
      },
      {
        "surface": "Αἰγαῖος",
        "passage_id": "smt.9.1"
      }
    ],
    "place_type": "sea",
    "lat": 38.913963,
    "lon": 24.917236,
    "certainty": "secure",
    "pleiades_id": "560221",
    "pleiades_uri": "https://pleiades.stoa.org/places/560221",
    "coordinates_source": "Pleiades reprPoint (refreshed 2026-05-10)",
    "notes": "Comparison context; category C in the Lemnos route per the do_not_map list."
  },
  {
    "place_key": "alexandria_troas",
    "display_name": "Alexandria Troas",
    "ancient_names_in_galen": [
      {
        "surface": "Ἀλεξανδρεία Τρῳάς",
        "passage_id": "smt.9.1"
      },
      {
        "surface": "Ἀλεξανδρείας Τρῳάδος",
        "passage_id": "smt.9.1"
      },
      {
        "surface": "Τρῳάδος Ἀλεξανδρείας",
        "passage_id": "smt.9.1"
      },
      {
        "surface": "Ἀλεξανδρείαν Τρῳάδα",
        "passage_id": "smt.9.1"
      },
      {
        "surface": "Τρῳὰς Ἀλεξάνδρεια",
        "passage_id": "smt.9.1"
      }
    ],
    "place_type": "city",
    "lat": 39.751699149,
    "lon": 26.1575573013,
    "certainty": "secure",
    "pleiades_id": "550434",
    "pleiades_uri": "https://pleiades.stoa.org/places/550434",
    "coordinates_source": "Pleiades reprPoint (snapshot 2026-05-09 dump)",
    "notes": "Multi-word toponym; the Galen surface forms always pair Alexandria with Troad. Override exists because the auto-detector resolves 'Ἀλεξάνδρεια' alone to 20 ambiguous Pleiades records and 'Τρῳάς' to the broader Troad region — neither is right for the embarkation port in SMT 1/2."
  },
  {
    "place_key": "asia_province",
    "display_name": "Asia (Roman province)",
    "ancient_names_in_galen": [
      {
        "surface": "Ἀσία",
        "passage_id": "smt.9.1"
      },
      {
        "surface": "Ἀσίαν",
        "passage_id": "smt.9.1"
      },
      {
        "surface": "Ἀσίας",
        "passage_id": "smt.9.1"
      },
      {
        "surface": "Ἀσίᾳ",
        "passage_id": "de_antidotis.1"
      }
    ],
    "place_type": "region",
    "lat": 38.4607221567,
    "lon": 27.7761048198,
    "certainty": "secure",
    "pleiades_id": "981509",
    "pleiades_uri": "https://pleiades.stoa.org/places/981509",
    "coordinates_source": "Pleiades reprPoint (snapshot 2026-05-09 dump)",
    "notes": "In Galen's autobiographical contexts, 'from Asia to Rome' refers to the Roman province of Asia / western Asia Minor, not the continent. Locks the otherwise-ambiguous Pleiades match (5 candidates) to 981509."
  },
  {
    "place_key": "chios",
    "display_name": "Chios",
    "ancient_names_in_galen": [
      {
        "surface": "Χίος",
        "passage_id": "smt.9.1"
      },
      {
        "surface": "Χίον",
        "passage_id": "smt.9.1"
      }
    ],
    "place_type": "island",
    "lat": 38.3836419,
    "lon": 26.0142412,
    "certainty": "secure",
    "pleiades_id": "550497",
    "pleiades_uri": "https://pleiades.stoa.org/places/550497",
    "coordinates_source": "Pleiades reprPoint (refreshed 2026-05-10)",
    "notes": "Same comparison context as Samos; category C."
  },
  {
    "place_key": "coele_syria",
    "display_name": "Coele Syria",
    "ancient_names_in_galen": [
      {
        "surface": "κοίλη Συρία",
        "passage_id": "smt.9.1"
      },
      {
        "surface": "κοίλην Συρίαν",
        "passage_id": "smt.9.1"
      },
      {
        "surface": "κοίλης Συρίας",
        "passage_id": "smt.9.1"
      },
      {
        "surface": "κοίλῃ Συρίᾳ",
        "passage_id": "smt.9.1"
      },
      {
        "surface": "Συρία",
        "passage_id": "smt.9.1"
      },
      {
        "surface": "Συρίαν",
        "passage_id": "smt.9.1"
      },
      {
        "surface": "Συρίας",
        "passage_id": "smt.9.1"
      },
      {
        "surface": "Συρίᾳ",
        "passage_id": "smt.9.1"
      }
    ],
    "place_type": "region",
    "lat": 33.75,
    "lon": 36.75,
    "certainty": "secure",
    "pleiades_id": "678096",
    "pleiades_uri": "https://pleiades.stoa.org/places/678096",
    "coordinates_source": "Pleiades reprPoint (snapshot 2026-05-09 dump)",
    "notes": "Multi-word region label; the κοίλη qualifier is lowercased in the TEI so the auto-detector can't catch it as a single proper noun. The override prevents 'Συρία' alone from defaulting to one of the six ambiguous Pleiades 'Syria' records."
  },
  {
    "place_key": "crete",
    "display_name": "Creta (island)",
    "ancient_names_in_galen": [
      {
        "surface": "Κρήτη",
        "passage_id": "de_antidotis.1"
      },
      {
        "surface": "Κρήτην",
        "passage_id": "de_antidotis.1"
      },
      {
        "surface": "Κρήτης",
        "passage_id": "de_antidotis.1"
      },
      {
        "surface": "Κρήτῃ",
        "passage_id": "de_antidotis.1"
      }
    ],
    "place_type": "island",
    "lat": 35.214847063,
    "lon": 25.0740796921,
    "certainty": "secure",
    "pleiades_id": "589748",
    "pleiades_uri": "https://pleiades.stoa.org/places/589748",
    "coordinates_source": "Pleiades reprPoint (snapshot 2026-05-09 dump; refreshed 2026-05-10)",
    "notes": "Mentioned in De antidotis 1.5 / 1.14 as the source of botanical materia (Cretan dittany etc.). Per the curator decision these passages are REJECTED as route evidence — Crete is source geography, not Galen travel. Kept here for the materia layer. Originally entered with Pleiades 589961 (Onysia island) by mistake; corrected to 589748 (Creta island) after the 2026-05-10 drift check."
  },
  {
    "place_key": "cyprus_island",
    "display_name": "Cyprus (island)",
    "ancient_names_in_galen": [
      {
        "surface": "Κύπρος",
        "passage_id": "smt.9.1"
      },
      {
        "surface": "Κύπρον",
        "passage_id": "smt.9.1"
      },
      {
        "surface": "Κύπρου",
        "passage_id": "smt.9.3"
      },
      {
        "surface": "Κύπρῳ",
        "passage_id": "smt.9.3"
      }
    ],
    "place_type": "island",
    "lat": 35.0009840667,
    "lon": 33.2188302483,
    "certainty": "secure",
    "pleiades_id": "707498",
    "pleiades_uri": "https://pleiades.stoa.org/places/707498",
    "coordinates_source": "Pleiades reprPoint (snapshot 2026-05-09 dump)",
    "notes": "Lock the bare-Cyprus mention to the island record (707498), not the Roman province (981516) or other variants. Galen's phrasing — 'to Cyprus for the mines' — is geographical, not administrative."
  },
  {
    "place_key": "cyzicus",
    "display_name": "Cyzicus",
    "ancient_names_in_galen": [
      {
        "surface": "Κύζικος",
        "passage_id": "smt.9.3"
      },
      {
        "surface": "Κυζίκου",
        "passage_id": "smt.9.3"
      },
      {
        "surface": "Κυζίκῳ",
        "passage_id": "smt.9.3"
      },
      {
        "surface": "Κύζικον",
        "passage_id": "smt.9.3"
      }
    ],
    "place_type": "city",
    "lat": 40.3855645,
    "lon": 27.883191,
    "certainty": "secure",
    "pleiades_id": "511218",
    "pleiades_uri": "https://pleiades.stoa.org/places/511218",
    "coordinates_source": "Pleiades reprPoint (snapshot 2026-05-09 dump)",
    "notes": "City on the Propontis; appears as context in the Pergamum → Ergasteria passage (SMT 9.3) and as a place Galen comments on minerals (De antidotis 1.10)."
  },
  {
    "place_key": "ergasteria",
    "display_name": "Ergasteria",
    "ancient_names_in_galen": [
      {
        "surface": "Ἐργαστήρια",
        "passage_id": "smt.9.3"
      },
      {
        "surface": "Ἐργαστηρίων",
        "passage_id": "smt.9.3"
      },
      {
        "surface": "Ἐργαστηρίοις",
        "passage_id": "smt.9.3"
      }
    ],
    "place_type": "mine",
    "lat": 39.727645,
    "lon": 27.59645,
    "certainty": "secure",
    "pleiades_id": "550534",
    "pleiades_uri": "https://pleiades.stoa.org/places/550534",
    "coordinates_source": "Pleiades reprPoint (snapshot 2026-05-09 dump)",
    "notes": "Mining settlement near Pergamum. Until this override 'Ἐργαστήρια' was being filtered as a generic noun ('workshops') by the survey stoplist; the override re-promotes it to a place because it is the actual destination of the Pergamum trip in SMT 6."
  },
  {
    "place_key": "hephaistia",
    "display_name": "Hephaistia",
    "ancient_names_in_galen": [
      {
        "surface": "Ἡφαιστιάς",
        "passage_id": "smt.9.1"
      },
      {
        "surface": "Ἡφαιστιάδα",
        "passage_id": "smt.9.1"
      },
      {
        "surface": "Ἡφαιστιάδος",
        "passage_id": "smt.9.1"
      },
      {
        "surface": "Ἡφαιστία",
        "passage_id": "smt.9.1"
      }
    ],
    "place_type": "city",
    "lat": 39.9645815,
    "lon": 25.3182289,
    "certainty": "secure",
    "pleiades_id": "550569",
    "pleiades_uri": "https://pleiades.stoa.org/places/550569",
    "coordinates_source": "Pleiades reprPoint (snapshot 2026-05-09 dump)",
    "notes": "City on Lemnos; the actual collection point for Lemnian earth in SMT 1/2. Galen uses both 'Ἡφαιστιάς' and 'Ἡφαιστία' forms."
  },
  {
    "place_key": "italia_peninsula",
    "display_name": "Italia",
    "ancient_names_in_galen": [
      {
        "surface": "Ἰταλία",
        "passage_id": "smt.9.1"
      },
      {
        "surface": "Ἰταλίαν",
        "passage_id": "smt.9.1"
      },
      {
        "surface": "Ἰταλίας",
        "passage_id": "smt.9.1"
      },
      {
        "surface": "Ἰταλίᾳ",
        "passage_id": "de_antidotis.1"
      }
    ],
    "place_type": "region",
    "lat": 43.6941505,
    "lon": 11.0949512,
    "certainty": "secure",
    "pleiades_id": "1052",
    "pleiades_uri": "https://pleiades.stoa.org/places/1052",
    "coordinates_source": "Pleiades reprPoint (snapshot 2026-05-09 dump)",